id,fecha,lugar,tipo_evento,tipo_evento_principal,subtipos_evento,quien_protesta,demanda,a_quien,discurso_framing,respuesta_estatal,fuente,resultado
,05-05-2018 / 15-05-2018,La Habana,Performance,Performance,Performance,Artistas/intelectuales,"LIBERTAD DE EXPRESIÓN. #00Bienal de La Habana, una nueva instancia artística, alternativa, independiente y reaccionaria a cualquier entidad estatal. Esta bienal busca reestructurar el modelo de acción de la Bienal de La Habana (oficial) con base en lo colectivo, la colaboración y la proyección internacional, con el fin de apuntalar el arte como una fuerza revitalizadora para la sociedad cubana. Su propósito, enfatizan, es “desatar” el arte cubano de lo que perciben como la «burbuja oficial del mundo del arte», y reconectar la cultura con las realidades sociales cubanas. Es un evento inclusivo, democrático, planificado desde la colaboración entre los artistas y buscando establecer conexiones con el pueblo cubano. Este proyecto fue iniciado por el artista Luis Manuel Otero Alcántara y la curadora Yanelys Núñez Leyva.",Estado cubano (Ministerio de Cultura),NULL,"Después de ser anunciada la Bienal #00, la Unión de Escritores y Artistas de Cuba (UNEAC) y la Asociación Hermanos Saíz hicieron una declaración donde se lee: “Rechazamos cualquier intento de entorpecer o manipular la gestión institucional y los proyectos de artistas de Cuba y otros países que están en marcha de cara a la XIII Bienal de La Habana. Denunciamos la autotitulada Bienal #00, que se enmascara detrás de una fraseología demagógica y cínica, y se organiza con fondos de la contrarrevolución mercenaria, cuyo único propósito es descaracterizar al sistema institucional, confundir a los artistas y crear un clima propicio para promover los intereses de los enemigos de la nación y de la obra revolucionaria que ha gestado e impulsado la Bienal de La Habana y muchos otros eventos de gran arraigo popular”. “Se han sumado a este engendro muy pocas personas, en su mayoría sin obra alguna de relevancia, que con intención malsana o por confusión buscan la notoriedad que puede ofrecerles la plataforma mercenaria y su sobreexposición en las redes sociales. Se anuncia su realización en espacios sin ninguna importancia más allá del intento fallido de atacar la política cultural, no pocos de ellos con actividades al margen de la ley. Se pretende desorientar a los artistas para que utilicen sus estudios, que cuentan con todo el apoyo de la institución, en función de una maniobra provocadora (…) Ningún comentario malintencionado, ninguna tergiversación de la política cultural cubana, ninguna patraña elaborada por personas inescrupulosas hará perder la fe de los artistas en un proceso social que ha defendido el arte y la cultura como una de las más nobles proezas (…) No permitiremos que se empañe el nombre y el significado de la Bienal de La Habana, para la que nos preparamos, convencidos de que será la auténtica fiesta popular de la creación visual contemporánea”.",https://artishockrevista.com/2018/05/05/00bienal-de-la-habana-alternativa-independiente-reaccionaria/ https://arbolinvertido.com/cultura/la-bienal-00-que-viene-declaraciones-de-yanelis-nunez,NULL
,23-08-2018,La Habana,Carta abierta,Carta abierta,Carta abierta,Artistas/intelectuales,"LIBERTAD DE EXPRESIÓN. Artistas cubanos del movimiento #NoalDecreto349 hicieron el jueves entrega en diferentes instancias de poder del país de una carta de protesta contra esa disposición de control de las manifestaciones artísticas. El documento denuncia que el Decreto 349/2018 establece legalmente un sistema de censura previa para las actividades culturales, las artes y otras formas de expresión, violentando la libertad para la actividad creadora y el derecho al pleno desarrollo de la personalidad humana. También violenta la libertad de pensamiento, creencia y religión; la libertad de opinión, asociación y reunión pacífica. Ningún individuo sometido a la jurisdicción del Estado cubano podrá disfrutar libremente de las producciones y espectáculos artísticos o desarrollar y exponer en público sus habilidades, talentos y actitudes artísticas, sin autorización del Estado"". El documento fue entregado en: la Fiscalía General, la Asamblea Nacional del Poder Popular, el Consejo de Estado y en el Ministerio de Cultura.","Estado cubano (Instituciones culturales, Fiscalía General de la República, Parlamento)",#NO AL DECRETO 349,"El ministro de Cultura, Alpidio Alonso, dice que la norma ""no empezará a operar de inmediato en determinadas áreas, sino de manera progresiva"". La ley en principio permitiría a los ""inspectores supervisores"" revisar cualquier evento cultural, desde exposiciones de pintura a conciertos, e inmediatamente decretar el cierre de un espectáculo e, incluso, confiscar una licencia comercial de un restaurante o un bar que albergue un evento objetable. Ha afirmado también que los inspectores solo responderán a las quejas sobre asuntos culturales y referirán los casos problemáticos a funcionarios de mayor rango del Ministerio de Cultura. Tampoco podrán inspeccionar ningún estudio u hogar que no esté abierto al público.",https://www.ipscuba.net/sociedad/2018-cuando-la-ciudadania-cubana-se-hizo-sentir/  https://www.radiotelevisionmarti.com/a/activistas-contra-el-decreto-349-llevan-su-protesta-a-instancias-del-gobierno/207378.html ref_src=twsrc%5Etfw%7Ctwcamp%5Etweetembed%7Ctwterm%5E1032964586662764544%7Ctwgr%5E6dab11d154ae9c36006138b35ce87350257ba1b0%7Ctwcon%5Es1_&ref_url=https%3A%2F%2Fwww.radiotelevisionmarti.com%2Fa%2Factivistas-contra-el-decreto-349-llevan-su-protesta-a-instancias-del-gobierno%2F207378.html https://www.dw.com/es/noaldecreto349-contra-la-criminalizaci%C3%B3n-del-arte-en-cuba/a-45258869 https://www.dw.com/es/noaldecreto349-contra-la-criminalizaci%C3%B3n-del-arte-en-cuba/a-45258869 https://www.cibercuba.com/videos/noticias/2018-12-06-u1-e129488-s27061-gobierno-cuba-intenta-suavizar-impacto-decreto-349?fbclid=IwAR0iai8aTHHBJCLSGRbP0ZsKhySQIS-KlfDLbL8gp__PV2ijFDbtIMY3Uec,NULL
P18-16,13-09-2018,La Habana,Carta abierta,Carta abierta,Carta abierta,Ambientalistas,"Ambientalistas pertenecientes a la organización autónoma Guardabosques se presentaron ante los ministerios de Relaciones Exteriores y el de Ciencia, Tecnología y Medio Ambiente, para exigir al gobierno cubano que firme el Acuerdo de Escazú. Los documentos a firmar por ambos ministerios exhortan a que se adopte “una postura proactiva, a fin de lograr la firma por parte del gobierno cubano”.",Estado cubano (Ministerio de Relaciones Exteriores),"Derechos ambientales. “Los ecosistemas cubanos, la población que forma parte de ellos, así como las instituciones, grupos, organizaciones y personas que trabajamos en su protección, seremos beneficiarios directos de la implementación de este Acuerdo”, afirman las cartas.",NULL,https://www.cibercuba.com/noticias/2018-09-16-u1-e186450-s27061-ambientalistas-piden-al-gobierno-cubano-firme-acuerdo-escazu y   https://guardabosquescuba.org/2018/09/15/ambientalistas-instan-al-gobierno-cubano-que-firme-el-acuerdo-de-escazu/,NULL
P18-17,10-2018 / 11-2018,La Habana,Performance,Performance,Performance,LGBTI,DERECHOS LGBT.I BESADAS PÚBLICAS EN PRADO Y MALECÓN y en iglesias contra la campaña evangélica contra el matrimonio igualitario.,"Estado cubano (Parlamento)/sociedad, contra la campaña de las iglesias",Derechos LGBTI,Algunas debieron ser suspendidas por no contar con autorización.,https://www.facebook.com/photo/?fbid=1953950438024511&set=g.123004041563340  y  https://www.facebook.com/photo/?fbid=1953950414691180&set=g.123004041563340,NULL
P18-18,10-2018 / 11-2018,La Habana,Manifestación/Campaña (varios),Manifestación,Campaña,Evangélicos,"Campaña contra art. 68, creyentes salieron a varios espacios públicos a difundir mensaje contra ideología de género. En feb. 2019 hicieron acto en el Malecón donde 200 parejas reafirmaron sus vínculos matrimoniales y se pronunciaron contra el matrimonio igualitario.",Estado cubano (Parlamento),Contra derechos LGBTI,TOLERANCIA,https://www.facebook.com/photo/?fbid=1830813450338211&set=g.123004041563340  y  https://www.facebook.com/metodistademarianao/photos/a.1567504973564901/2182373215411404/?type=3,NULL
P18-19,01-12-2018,San Cristobal Artemisa,Huelga,Huelga,Huelga,TPCP (cocheros),"DERECHOS ECONÓMICOS CONTRA RESTRICCIONES. Los conductores de coches de caballo de San Cristóbal, Artemisa, se han declarado en huelga en señal de protesta contra nuevas restricciones dictadas por el Consejo de Administración Municipal (CAM). Los cocheros han decidido echar un pulso contra las autoridades para que deroguen las medidas que les impiden entrar al poblado y los obligan a solo transitar por las vías exteriores.",Autoridades locales,"No podemos decir públicamente que estamos en huelga, porque en Cuba no es permitido, pero vamos a permanecer sin trabajar hasta que se llegue a un acuerdo. ""No les bastó con alejarnos cinco cuadras de las vías principales, ahora no nos permiten entrar al pueblo para nada"", lamenta. ""El objetivo es que la gente vea los coches circulando y se entere de lo que está sucediendo"", explica a este diario Maikel, un joven cochero que se ha sumado a la huelga. ""Tenemos que recoger evidencia de la cantidad de personas a las que beneficia nuestro servicio, con un poco de suerte habrá más quejas de la población a favor de nosotros y las autoridades tendrán que echar atrás la medida"".","IGNORAR. El Gobierno local ha respondido hasta ahora colocando un nuevo ómnibus que cubrirá la ruta desde el parque principal de San Cristóbal hasta el hospital, dos veces al día. Una manera de aliviar la tensión que se ha creado en los pasajeros al no poder trasladarse en los coches de caballo que tradicionalmente hacen ese tramo.",https://www.14ymedio.com/cuba/cocheros-inician-Artemisa-medidas-Gobierno_0_2556944285.html,NULL
,01-12-2018,"Banes, Holguín",Huelga,Huelga,Huelga,TPCP (cocheros),"DERECHOS ECONÓMICOS CONTRA IMPUESTOS. La protesta silenciosa fue en rechazo a la decisión del régimen de subirle los impuestos, retirarle la licencia de carga de mercancía, e imponerles que redujeran el costo de los pasajes, por lo que los cuentapropistas entregaron sus licencias el pasado viernes, en la Oficina de Administración Tributaria Municipal (ONAT).","Autoridades locales (Oficina de Administración Tributaria municipal, ONAT)",NULL,"Autoridades en Banes cedieron a las demandas de decenas de cocheros en el municipio. La Seguridad del Estado entonces decidió citar a unos 43 conductores, donde les informaron que sus demandas serían atendidas. Les dijeron que a partir del primero de enero podrían cobrar sus precios normales y directamente a los pasajeros, que eso también se lo habían quitado. Fueron atendidos por el capitán Roilán Rojas.",https://www.cubaenmiami.com/autoridades-en-banes-holguin-responden-a-la-protesta-silenciosa-de-los-cocheros/ https://cubanosporelmundo.com/2018/12/12/cocheros-holguin-protesta-silenciosa/  https://observatoriocubano.com/2018/12/13/decenas-de-cocheros-en-banes-entregan-sus-licencias-ante-nuevas-restricciones/,43 cocheros ganaron la demanda contra las autoridades y les tuvieron que reintegrar la segunda licencia
,10-12-2018,La Habana,Manifestación/Concentración/Bloqueo,Manifestación,"Concentración, Bloqueo",Ciudadanos/pueblo,"Servicios (vivienda). Los residentes del solar conocido por Míster Joe llevaron a cabo una protesta al cerrar la vía pública con muebles, donde exigían el cumplimiento de promesas gubernamentales sobre nuevas viviendas para los vecinos.",Autoridades locales,NULL,"Cuarenta minutos después de iniciada la protesta comenzó a notarse la presencia policial, limitada a desviar el tráfico de vehículos hacia las calles laterales, hasta la llegada de funcionarios del Gobierno local. Los dirigentes, acompañados por varios policías, entraron al solar para verificar los daños totales de las pertenencias, prometiendo, una vez más, la solución del problema en un término de 24 horas.",https://www.cubanet.org/destacados/cuba-habana-protesta-vivienda/,NULL
,12-2018,La Habana,Huelga,Huelga,Huelga,TPCP (boteros),DERECHOS ECONÓMICOS CONTRA IMPUESTOS,Autoridades locales,"Nuevas medidas para el “reordenamiento del transporte en la capital”. Las nuevas medidas incluían la firma de un contrato con la Empresa Provincial de Transporte para hacer rutas específicas, precios topados, el uso de una tarjeta magnética para la compra de combustible y la obligación de abrir una cuenta bancaria. Un grupo de choferes privados pertenecientes a la Asociación Cubana de Transportistas Autónomos, presidida por su coordinador nacional, Rafael Alba Macías, y localizados en el parque El Curita, en Centro Habana, decidieron dejar de ofrecer el servicio, no ir a la piquera y no recoger pasaje en las calles, lo que dio comienzo a una especie de huelga silenciosa. En los siguientes días se sumaron más privados a la protesta en los diferentes barrios.","REPRESIÓN Y DIÁLOGO. El líder de los choferes fue detenido y, al ser liberado, anunció que la protesta se extendería hasta el 17 de diciembre. Los transportistas fueron entonces citados por las autoridades del sector, quienes les ofrecieron establecer una moratoria en la implementación de las medidas si ellos regresaban a dar servicio. Los boteros levantaron la protesta.",NULL,NULL
,21-12-2018,La Habana,Performance (juego de fútbol),Performance ,Performance,Artistas,LIBERTAD DE EXPRESIÓN. Contra el 349,Estado cubano (Ministerio de Cultura),Contra la censura y el 349,NULL,NULL,NULL
P18-20,01-02-2019,La Habana,Performance,Performance,Performance,LGBTI,"DERECHOS LGBTI. El proyecto “Dame la mano” se hizo viral en redes sociales, en una convocatoria de expresión libre que culminó con decenas de fotos de acciones públicas y performativas. La iniciativa también compartió imágenes de parejas LGBTI que paseaban tomadas de la mano por espacios de la ciudad.",Estado cubano (Parlamento)/sociedad,Derechos LGBTI,INDIFERENCIA (no incluyeron el art. 8),https://www.facebook.com/photo/?fbid=579033495841533&set=g.123004041563340,NULL
P18-21,14-02-2019,Matanzas y La Habana,Performance,Performance,Performance,LGBTI,DERECHOS LGBTI. Proyecto Arcoíris/formaron banderas humanas de arcoíris.,Estado cubano/sociedad,Derechos LGBTI,"El proyecto “Dame la mano” se hizo viral en redes sociales, en una convocatoria de expresión libre que culminó con decenas de fotos de acciones públicas y performativas. La iniciativa también compartió imágenes de parejas LGBTI que paseaban tomadas de la mano por espacios de la ciudad.",https://www.facebook.com/photo/?fbid=579067582504791&set=g.123004041563340 y https://www.facebook.com/photo/?fbid=579067572504792&set=g.123004041563340,NULL
P19-22,31-03-2019,Varias ciudades,Performance,Performance,Performance,LGBTI,"DERECHOS LGBTI. Día para visibilizar personas trans cristaliza en Cuba. Plazas y espacios públicos de varias ciudades cubanas se pintaron de colores, a partir de la propuesta de un grupo de activistas para reunirse y formar banderas humanas del arcoíris, coincidiendo con el Día de la Visibilidad de las personas transgénero, el 31 de marzo.",Estado cubano/sociedad,Derechos LGBTI,TOLERANCIA,https://ipscuba.com/genero/dia-para-visibilizar-personas-trans-cristaliza-en-cuba/    https://www.ipscuba.net/sociedad/2019-del-activismo-digital-a-la-accion-ciudadana/,NULL
P19-23,07-04-2019,La Habana,Marcha animalista autorizada,Marcha,Marcha,Animalistas (200 personas),"DERECHOS ANIMALES. Los manifestantes demandan el fin de la crueldad con los animales en Cuba. Llegaron varias personas, todas con sus perros y gatos atados a correas o envueltos en telas dentro de coches de niños; en su mayoría son mujeres. La marcha se realizó por la calle 25 hasta 12 y terminó en la tumba de Rinti.",Estado cubano,"Consignas y pancartas: «Hablamos por los que no tienen voz», «CAMBIAMOS DE CONDUCTA O CAMBIAMOS DE PLANETA», «ELLOS NO CONOCEN LAS SEÑALES DE TRÁNSITO, PERO TÚ SÍ. BAJA LA VELOCIDAD. SU VIDA IMPORTA», «POR UNA SOCIEDAD SIN VIOLENCIA, DI NO AL MALTRATO ANIMAL», «LOS ANIMALES TAMBIÉN TIENEN DERECHOS», «CUBA CONTRA EL MALTRATO ANIMAL»","El gobierno socialista ha autorizado de forma explícita una marcha pública no relacionada con ningún aspecto del amplio Estado comunista, una decisión que participantes e historiadores consideran muy inusual y quizá sin precedentes desde los primeros años de la revolución.",https://apnews.com/article/2d40e6c6434a4da8bc6b37c61ac2a2bd https://revistaelestornudo.com/animales-activistas-independientes-ley-proteccion-cuba/,NULL
P19-24,11-05-2019,La Habana,Marcha gay,Marcha,Marcha,Comunidad LGBTIQ y aliados (200 personas),"DERECHOS LGBTI. A favor de los derechos de las personas LGBTIQ y en respuesta a la suspensión por parte del Centro Nacional de Educación Sexual (CENESEX) de la tradicional Conga contra la Homofobia y la Transfobia, que se había hecho con apoyo del gobierno durante 11 años consecutivos, y las detenciones por parte del gobierno de algunos de sus principales promotores en la intersección de Paseo del Prado y Avenida Malecón, han desatado múltiples reacciones en las redes sociales y en otras plataformas del ciberespacio, como algunos blogs. Se llevó a cabo una caminata desde el Parque Central hasta el Malecón.","Autoridades locales (Centro Nacional de Educación Sexual, CENESEX)","Gritaron consignas como: ""Cuba diversa"", ""¡Sí se pudo!"", ""¡Cuba, lo más grande!""","A pesar de no tener la autorización correspondiente, las autoridades policiales y del Ministerio del Interior acompañaron y custodiaron por varias cuadras ese extenso paseo. Hubo represión durante la marcha por parte de la dictadura, ya que había policías vestidos de civiles, policías uniformados, patrullas, camiones a los costados, etc. Fueron muy poco civilizados, la mayoría con las peores maneras, bastante faltos de respeto y despectivos hacia la comunidad. Detuvieron a varios de los manifestantes.",https://eltoque.com/marcha-del-11-de-mayo-consecuencias,NULL
,01-06-2019,La habana,Manifiesto/Comunicado,Manifiesto,Comunicado,SNET,"Necesidad de mantener espacios de recreación sana, en defensa de su red independiente al Estado.",Estado cubano (Ministerio de Comunicaciones),"En defensa de su red, quieren mantener canales de diálogo con las autoridades.",NULL,https://www.dropbox.com/s/nuoor27ex6h3ivz/2019-06-01%20Comunicado%20Oficial%20Equipo%20Administraci%C3%B3n%20SNET%20-%20Nuevas%20Regulaciones.pdf?dl=0&fbclid=IwAR34NHFLPLXDWbqe4KyqwTvYJ3OpfIT2KX8wwlLwdBSBTfT1FyGJ5O6cYdg,NULL
,02-06-2019,La Habana Vieja,Manifestación/Concentración,Manifestación,Concentración,Ciudadanos/pueblo,Servicios (agua). Decenas de personas cerraron una importante avenida con cubos de agua mientras se quejaban por la falta del líquido en sus hogares debido a que llevaban casi 20 días sin suministro de agua.,Autoridades locales,"""No fue tanto una protesta, estábamos pidiendo que nos pusieran el agua porque había problemas con la entrada de agua (…) No era nada realmente político"". ""Once días sin agua y el gobierno, estamos cansados de ir, y no nos responden, no nos mandan una pipa"", dijo una de las personas que protestó en un video divulgado en redes sociales y publicado luego en medios de prensa en EE. UU.",La policía controló la situación y hubo diálogo con autoridades.,https://www.martinoticias.com/a/protesta-en-la-habana-vieja-por-falta-de-agua-/240102.html,NULL
,11-06-2019,La Habana,Recogida de firmas,Recogida de firmas,Recogida de firmas,TPCP,Derechos de TPCP (internet). Los dueños de Snet recogen firmas para superar la cifra de 10 mil personas y reclamar un cambio en la legislación que entra en vigor sobre el acceso a internet.,Autoridades locales,NULL,NULL,https://www.cubatel.com/blog/snet-y-la-recogida-de-firmas-del-internet-cubano/,NULL
,07-2019,Santiago de Cuba,Huelga,Huelga,Huelga,TPCP transportistas,DERECHOS ECONÓMICOS CONTRA IMPUESTOS,Autoridades locales,"Nuevos precios topados para los transportistas privados. Ante el anuncio, los choferes privados expresaron que la medida era injusta, y que “con los precios del combustible y las roturas” la cuenta no daba. En protesta, decidieron no ofrecer más servicio, provocando una crisis en la capital provincial.",DIÁLOGO. El primer secretario del Partido Comunista en Santiago de Cuba convocó a la Asamblea Provincial del Poder Popular para tratar la crisis con los transportistas privados tras la paralización del sector. Lázaro Expósito Canto se reunió con los afectados en el teatro Heredia y decidió convocar a la Asamblea Provincial para que los delegados decidieran sobre el precio a cobrar.,https://www.radiotelevisionmarti.com/a/protestas-en-cuba-durante-2019-que-lograron-su-prop%C3%B3sito/254118.html,"Se satisfizo la demanda. Los privados se incorporaron con recelo al trabajo el 31 de julio, luego de que el gobierno local diera marcha atrás al tope de precios de las tarifas que motivó una prolongada protesta y la paralización del servicio"
P19-27,01-08-2019,La Habana,Carta abierta,Carta abierta,Carta abierta,Afrodescendientes,"DISCRIMINACIÓN RACIAL. La Cofradía de la Negritud envió al presidente de los Consejos de Estado y de Ministros, Miguel Díaz-Canel, una Carta Abierta titulada “Algunas consideraciones sobre la problemática racial en Cuba”. Al parecer, como ya ha pasado en otras ocasiones, la misiva se quedará esperando respuesta.",Presidente del Estado cubano,Discriminación racial,SIN RESPUESTA,https://www.cubanet.org/noticias/envian-carta-abierta-a-diaz-canel-sobre-problematica-racial-en-cuba/,NULL
,02-08-2019,La Habana,Manifestación/Concentración,Manifestación,Concentración,Ciudadanos/pueblo,Servicios (vivienda). Miembros de varias familias albergadas acudieron este miércoles a la sede de la Asamblea Provincial del Poder Popular exigiendo mejores condiciones habitacionales.,Autoridades locales,NULL,La respuesta de las autoridades locales fue que se dirigieran a la Dirección Provincial de Vivienda. Allí les prometieron que iban a ser atendidos por el director provincial del organismo y otros funcionarios gubernamentales.,https://www.cubanet.org/mas-noticias/familias-albergadas-protestan-frente-al-gobierno-provincial-de-la-habana/,NULL
,07-08-2019,La Habana,Carta abierta,Carta abierta,Carta abierta,GAMERS (jóvenes de Snet),Servicios (internet),Díaz Canel/ atención a la población del Comité Central/Consejo de Estado/MINCOM/Poder Popular,"""Respetamos los canales y procedimientos establecidos y solo pedimos seguir siendo partícipes de la informatización en cada barrio, cuestión donde somos pioneros. Si pedimos mantener la red es precisamente por el desarrollo que ha alcanzado y su labor uniendo barrios, llevando entretenimiento y conocimiento a muchos hogares del país, ayudando a formar valores positivos para nuestra sociedad. Y sobre todo para mantener esta enorme familia que hemos creado"".",NULL,https://www.facebook.com/100013937675913/posts/645145355960048?s=100000143447988&sfns=mo,NULL
,10-08-2019,La Habana,Concentración/Plantón,Concentración,Plantón,GAMERS (jóvenes de Snet),"DERECHO A INTERNET. La demanda es reclamar a las autoridades el reconocimiento y la legalización de la red clandestina Snet ante las resoluciones 98 y 99 implantadas por el Ministerio de las Comunicaciones, en las que declaraban que las redes inalámbricas deben tener un límite que no sobrepase los 100 milivatios, que se prohíban las redes malladas y que los cables no puedan cruzar las calles; estas dos últimas, las principales causas que hicieron salir del juego a SNET, ya que su radio de conexión unía a diferentes municipios. La resolución a la cual se opone Snet los obliga a entregar sus equipos a los JCC o, de otra forma, quedarían todos decomisados.",Estado cubano (Ministerio de las Comunicaciones),"Carteles: ""Todo por Snet, Somos una familia"".","La policía política movilizó efectivos alrededor de la zona para evitar cualquier tipo de aglomeración de personas. También se informa de la presencia de agentes frente a las residencias de activistas y periodistas independientes. Los jóvenes han sido asediados y amenazados por la policía con arrestos para que no continúen sus esfuerzos. Tal es así que una segunda organización programada para el 17 de agosto no se materializó. Posteriormente se realizó una reunión para llegar a un acuerdo que concluyó en la fragmentación de Snet. Los Joven Club de Computación del Estado cubano, que no contaban con un servicio de red inalámbrica wifi como alternativa a las carencias de internet, adoptaron la lógica y la experiencia Snet para, después de un año gratis, empezar a cobrar por los servicios que usurparon.",https://www.youtube.com/watch?v=lYVIOEXfDPo&t=45s https://www.cubaenmiami.com/snet-pierde-la-batalla-contra-el-mincom-y-la-red-callejera-podria-pasar-a-manos-de-los-joven-club-de-computacion-estatales/,NULL
P19-28,07-10-2019,La Habana,Manifiesto/Comunicado/Carta,Manifiesto,"Comunicado, Carta",Periodismo independiente,"LIBERTAD DE PRENSA. Declaración conjunta de los medios independientes y la legalización de la prensa independiente. 19 medios de comunicación cubanos independientes, los periodistas de la isla denunciaron vivir una ola de represión por parte del gobierno de Miguel Díaz-Canel, para acallarlos.",Estado cubano,Libertad de expresión y prensa,NULL,https://latamjournalismreview.org/es/articles/19-medios-cubanos-independientes-publican-declaracion-conjunta-para-exigirle-al-gobierno-mas-proteccion-y-respeto-a-la-prensa/,NULL
