id,fecha,lugar,tipo_evento,tipo_evento_principal,subtipos_evento,quien_protesta,demanda,a_quien,discurso_framing,respuesta_estatal,fuente,resultado
P07-01,13-09-2007/ 14-09-2007,Universidad de Oriente y Instituto Superior Julio Antonio Mella (ISJAM) Santiago de Cuba,Marcha,Marcha,Marcha,"Estudiantes universitarios (""unos 300"")","CONDICIONES DE VIDA Y POLÍTICAS INSTITUCIONALES. La protesta tuvo varios matices, desde el cuestionamiento político hasta la actitud negligente de la rectora Zaida Valdés Estrada. La principal demanda fue por la decisión de ""separar a las mujeres de los hombres"" en las residencias, es decir, en las becas de Quintero. A esto se sumó la protesta por la violación de una alumna el día anterior y los cuestionamientos de las condiciones de vida en la Universidad: mala alimentación, escasez de agua en los dormitorios y falta de iluminación.",Autoridades docentes del Rectorado de la Universidad,Los alumnos mostraron carteles y gritaron consignas a favor de una mayor apertura en las universidades y contra la medida conservadora y segregacionista.,"VIGILANCIA, GESTOS SIMBÓLICOS, MEJORA DE ALGUNAS CONDICIONES Y REPRESIÓN (EXPULSIONES). La solución más inmediata de las autoridades para aplacar los ánimos fue dar ""pase"" masivo a estudiantes; cerraron el comedor. Después de los primeros incidentes se resolvieron los problemas de iluminación de las áreas externas y mejoró la alimentación. Se efectuaría un ""acto de masas"" en la universidad, en el que hablaría el presidente de la FEU. Después fueron expulsados 46 estudiantes que protagonizaron la protesta masiva en el Rectorado. Tanto la Universidad de Oriente como el ISJAM estuvieron bajo la vigilancia de la Seguridad del Estado. El martes 25 de septiembre se efectuó una reunión general en la Universidad, y se especulaba que podría ser para informar las medidas tomadas contra los estudiantes que participaron en la protesta, pero hasta la fecha no ha trascendido la información.",https://www.cubanet.org/htdocs/CNews/y07/sep07/28a1.htm.   https://www.cubaencuentro.com/cuba/se-dice-que/protesta-masiva-en-la-universidad-de-oriente-46594,Mejoraron algunas condiciones
,17-12-2007,La Habana,Performance,Performance,Performance,Artistas/intelectuales OMNI,"Libertad de expresión. GARABATO PEREGRINACIÓN al Rincón. “La peregrinación del garabato es una promesa por la salud de la poesía; entendemos como poesía el estado general del país, de la nación cubana”.",Estado cubano/sociedad,"Libertad de expresión. “La peregrinación del garabato es una promesa por la salud de la poesía, entendemos como poesía el estado general del país, de la nación cubana”","TOLERANCIA, VIGILANCIA",NULL,NULL
,17-12-2008,La Habana,Performance,Performance,Performance,Artistas/intelectuales OMNI,"Libertad de expresión. GARABATO PEREGRINACIÓN al Rincón. “La peregrinación del garabato es una promesa por la salud de la poesía; entendemos como poesía el estado general del país, de la nación cubana”.",Estado cubano/sociedad,"Libertad de expresión. “La peregrinación del garabato es una promesa por la salud de la poesía, entendemos como poesía el estado general del país, de la nación cubana”","TOLERANCIA, VIGILANCIA",NULL,NULL
,22-10-2009,La Habana   ISA,Manifestación/Concentración,Manifestación,Concentración,Estudiantes universitarios,"Servicios. Los estudiantes del Instituto Superior de Arte piden comida, mejores condiciones en que los tienen obligados a vivir en la beca y libertad para expresarse. Los estudiantes especifican que no es una huelga, pero que no van a asistir a clases hasta que no cambien la comida. Realizan un performance por la falta de agua y comida del ISA y se escuchan cacerolazos.",Autoridades docentes de la Universidad,Por las condiciones de alimentación,NULL,http://www.cubademocraciayvida.org/web/print.asp?artID=10087,NULL
,27-11-2009,La Habana,Marcha/Performance,Marcha,Performance,Artistas/intelectuales/activistas (200 personas),"CONTRA LA VIOLENCIA. Los jóvenes, que iniciaron la caminata por una de las aceras de la calle 23 en la tarde del viernes, llegaron hasta L, donde se encuentra el hotel Habana Libre; cruzaron al cine Yara y, por la acera de la heladería Coppelia, continuaron su marcha, en sentido contrario, hasta G. Sobre los objetivos de la acción, la mayoría coincide en que se cumplieron. Para YN, “era que se lograra hacer la protesta que había sido organizada desde una iniciativa independiente, algo aún impensable en Cuba” y que “se pudiera denunciar las violencias políticas que ejerce el gobierno sobre sus ciudadanos, aunque no se dijese explícitamente en los carteles”.",Estado cubano/sociedad,NULL,"VIGILANCIA, INTENTO DE CONCILIACIÓN Y COOPTACIÓN A TRAVÉS DE DIÁLOGO. La esquina de 23 y G estaba completamente tomada por la Seguridad del Estado de civil y por policías uniformados. También la calle paralela (25) estaba llena de pequeños buses y camiones que la policía usa para cargar personas, pero no llegaron a usarlos. Allí se personaron funcionarios como el viceministro de Cultura Fernando Rojas y el entonces presidente de la Asociación Hermanos Saíz, Luis Morlote, con el ánimo de persuadirnos de que no realizáramos la acción. Pero no les escuchamos. Las autoridades estaban muy presentes. Desde temprano detuvieron gente y enviaron a otros a convencer, por ejemplo a Aldo, de que no participara. Además, había muchos de la Seguridad del Estado filmando todo el proceso; tenían tremendas caras de susto, como si esperaran mucho más que aquellos pocos metros caminados. (…) Después de esa tarde nos citaron, intimidaron y trataron de comprar a todos. Yo fui, obviamente, un blanco importante para ellos.",https://www.programacuba.com/27n9    https://www.elmundo.es/america/2009/11/07/cuba/1257610631.html  https://www.facebook.com/watch/?v=288097843236704,NULL
,17-12-2009,La Habana,Marcha/Performance,Marcha,Performance,Artistas/OMNI,"Libertad de expresión. “La peregrinación del garabato es una promesa por la salud de la poesía; entendemos como poesía el estado general del país, de la nación cubana”.",Estado cubano/sociedad,NULL,NULL,NULL,NULL
,18-12-2009,La Habana,Carta abierta (46 firmantes y 6 colectivos) OBSERVATORIO CRITICO,Carta abierta,Carta abierta,Artistas/intelectuales/académicos/activistas,"LIBERTAD DE EXPRESIÓN. Aceptación de la diversidad contra represión silenciosa a proyectos culturales, académicos autónomos y activismos sociales; contra acciones desde la “institucionalidad oficial” contra iniciativas culturales caracterizadas por el compromiso activista en pro de una autonomía solidaria. Vemos con gran preocupación la posibilidad de que este tipo de actos desacertados y esterilizantes se generalicen como tendencia. Sentimos en ellos el resurgir de un pensamiento que creíamos ya desterrado de la vida cultural de nuestro país. Nos posicionamos en contra de tal represión silenciosa que está afectando a proyectos y personas cuyo único “error” ha sido el de llevar a cabo iniciativas que no fueron “orientadas desde arriba”.",Estado cubano,"Si el capitalismo es el poder del capital frente a la gente de a pie, entonces estamos en contra del capitalismo, y si el “socialismo” es el poder de una burocracia en contra del resto de la sociedad, entonces también estamos en contra de este “socialismo”. Pero el socialismo no tiene que ser esto, el socialismo que nos entusiasma es el proyecto que socializa –comparte– todos sus recursos, donde todos tenemos igual acceso al ejercicio del poder; y no crea alguien que nos referimos a una utopía: ya hay por ahí algunos hogares y colectivos que hacen realidad estas prácticas. La creciente política de concebir a aquellos que piensan y actúan diferente a “lo orientado” como “disidentes”, “mercenarios” o “contrarrevolucionarios” deja muy poco espacio a la crítica socialista. No hay respeto por la diversidad.","IGNORAR (SILENCIO ANTE EL RECLAMO), PRESIONES Y REPRESIÓN SELECTIVA",http://barcelona.indymedia.org/newswire/display/388657,Sacaron los proyectos de las instituciones
,29-11-2010,"Santa Clara, Villa Clara","Manifestación/Concentración/Motín (Disturbios, RIOT)",Manifestación,"Concentración, Motín (Disturbios, RIOT)",Ciudadanos/pueblo (jóvenes),"DERECHOS DEL CONSUMIDOR. Se registró una seria protesta social en Santa Clara, provincia de Villa Clara, donde participaron cientos de jóvenes que habían adquirido entradas para el cine, con el objetivo de presenciar un juego de fútbol entre el Barcelona y el Real Madrid, en España. Al parecer, por algún tipo de deficiencia técnica, no se pudo transmitir el evento y, cuando las personas salieron, comenzaron a reclamar que les devolvieran el dinero de las entradas. Cuentan que la mayoría eran jóvenes universitarios.",Autoridades locales,"Solicitud de que les devolvieran el dinero de las entradas, de eso pasaron a dar gritos con consignas antigubernamentales como: ¡Abajo Fidel! ¡Abajo la Revolución! ¡Abajo el Comunismo!",REPRESIÓN. Se efectuaron algunas detenciones.,https://www.cubanet.org/htdocs/CNews/year2010/Dic2010/03_C_1.html,NULL
P10-02,01-12-2010 / 02-12-2010,"Bayamo, Granma",Huelga/Plantón/Bloqueo,Huelga," Plantón, Bloqueo",TPCP (cocheros) (aproximadamente mil personas),"CONTRA IMPUESTOS. DERECHOS ECONÓMICOS. Desde las 6:00 a. m., los cocheros se pararon como protesta, demandando al régimen anular los onerosos impuestos que les obligan a pagar y que no van a trabajar hasta que les bajen el costo de la patente, que hay que bajarla a como estaba. Activistas de la Resistencia Cubana en esa zona se han unido en solidaridad a esta manifestación contra los dictámenes económicos del régimen comunista. “Estamos aquí apoyando un plantón, una huelga de trabajo cívica que están haciendo los cocheros de esta ciudad en protesta, ya que le han subido sus patentes, [el precio de] la comida de sus animales y están en protesta y no quieren salir a trabajar”. Aproximadamente un millar de cocheros decidieron realizar un paro protesta frente a la terminal de trenes en la ciudad oriental, donde radica la piquera central de los transportistas […]”.","Estado cubano (autoridades frente a la terminal de trenes en la ciudad oriental, donde radica la piquera central de los transportistas)","Los impuestos del gobierno son demasiado altos. ""Ya la gente no está montando coche"", añadió. ""No tenemos con qué pagar"".","DIÁLOGO E INTENTO DE REPRESIÓN. Al parecer hubo diálogo, ver Martí Noticias. En el centro de la ciudad hay varios jeeps con personas de las Brigadas de Respuesta Rápida, hay patrullas y están los gendarmes de la Seguridad del Estado. “El primer secretario del Partido en la provincia”, nombrado al parecer, hubo algún diálogo y algunos decidieron abandonar la protesta al día siguiente, ver Martí Noticias. Luis Rafael Virelles, también el presidente de la Asamblea Provincial del Poder Popular, estuvieron donde la aglomeración de los cocheros y el pueblo; quisieron dar un sermón, pero los cocheros dijeron que no querían ningún tipo de conversación, sino que se restableciera todo como estaba”. En la mañana del día 2 de diciembre, el paro continuaba. Un jeep con un altoparlante circulaba pidiéndoles a los cocheros que se incorporaran al trabajo. La situación era muy difícil, pues a la hora de entrar a trabajar el pueblo no tenía cómo transportarse. El gobierno ha puesto guaguas, ha puesto camiones. A los camioneros particulares los han obligado a que transporten a las personas, pero nada, eso no da abasto porque son muchas personas.",https://cubaout.wordpress.com/2010/12/02/cuba-paro-de-cocheros-en-bayamo-contra-los-impuestos/ https://soundcloud.com/directorio-cuba/huelga-de-cocheros-en-bayamo-12-1-2010 https://www.radiotelevisionmarti.com/a/paro-laboral-di/666.htmlhttps://www.cubanet.org/htdocs/CNews/year2010/Dic2010/03_C_1.html,"Se satisfizo la demanda. Tras días de asedios y debates, las autoridades cedieron a rebajar los impuestos, liberaron los precios a cobrar y no sancionaron por el parón"
,07-12-2010,Sancti Spiritus,Manifestación/Concentración,Manifestación,Concentración,Ciudadanos/pueblo/TPCP,"Derecho TPCP (impuestos). Grupo de cocheros que trabajan por cuenta propia, para protestar por los elevados impuestos y por la eliminación de la piquera del hospital provincial Camilo Cienfuegos.",Autoridades locales,NULL,"La manifestación fue rodeada por carros patrulleros y motocicletas de la policía, y solo fueron recibidos dos cocheros, a quienes se les aceptó el reclamo del paradero del hospital, pero no el relativo a los impuestos.",https://www.cubanet.org/htdocs/CNews/year2010/Dic2010/07_N_1.html,NULL
,17-12-2010,La Habana,Performance,Performance,Performance,Artistas/intelectuales/OMNI,"LIBERTAD DE EXPRESIÓN, POR LA PAZ DE LA SOCIEDAD.",NULL,"Libertad de expresión. “La peregrinación del garabato es una promesa por la salud de la poesía, entendemos como poesía el estado general del país, de la nación cubana”",NULL,NULL,NULL
,06-01-2011,"Punta Brava, La Lisa, La Habana",Manifestación/Concentración,Manifestación,Concentración,Ciudadanos/pueblo,"Servicios (agua). Los vecinos de Punta Brava, tras llevar 17 días sin agua, salieron a las calles a protestar. La protesta consistió en la colocación en las aceras de cubos vacíos, a lo largo de la avenida, y allí los mantuvieron durante una hora, hasta que la policía obligó a los vecinos a guardarlos.",Autoridades locales,NULL,La policía reprimió la protesta.,https://www.cubanet.org/noticias/protestan-con-cubos-vacios/?print=print,NULL
,13-01-2011,"Punta Brava, La Lisa, La Habana",Manifestación/Concentración,Manifestación,Concentración,Ciudadanos/pueblo,Servicios (agua). Una docena de mujeres se manifestó en las calles del poblado de Punta Brava para exigir que llegue el agua potable a las viviendas de la comunidad.,Autoridades locales,“Queremos agua. ¿Hasta cuándo será esto?”,"Los agentes de Seguridad del Estado se apostaron en los alrededores de la vivienda de Silvio Benítez Márquez (opositor del régimen), mientras se producía la protesta, con el objetivo de que el opositor no saliera a las calles en apoyo a la manifestación.",https://www.cubanet.org/noticias/protesta-en-punta-brava/,NULL
,20-06-2011,"Santa Clara, Villa Clara",Huelga/Paro de labores,Huelga,Paro de labores,Campesinos/cooperativistas,"Derechos TPCP (condiciones de trabajo). Trabajadores agrícolas protestaron ante la administración por las pésimas condiciones de trabajo de la cooperativa Batalla de Santa Clara. Los agricultores declararon un paro laboral de 24 horas para demandar una respuesta rápida de los directivos de la unidad, los cuales cambiaron de lugar la vaquería sin tener en cuenta la escasez de agua y la inadecuada infraestructura del nuevo sitio. Los obreros agrícolas manifestaron que las condiciones para el ordeño de las vacas son pésimas, ya que allí no hay naves techadas y, con el inicio de las lluvias, los vaqueros tienen que lidiar con los aguaceros, causantes también del deterioro de las vías de acceso a la vaquería.",Autoridades locales,NULL,NULL,https://www.cubanet.org/noticias/protestan-trabajadores-agricolas/,NULL
,18-07-2011,Guantánamo,Manifestación/Concentración,Manifestación,Concentración,Ciudadanos/pueblo,"Servicios (electricidad). Al menos 80 campesinos cubanos del poblado El Mije protestaron frente a la sede del Poder Popular Municipal de San Antonio del Sur, para que se les reinstalara el servicio eléctrico.",Autoridades locales,NULL,"Los manifestantes fueron atendidos por el presidente, Warter Gamboa. Al no recibir respuestas claras y convincentes, la presencia de los campesinos frente a la sede de gobierno se convirtió en una abierta manifestación pública de inconformidad.",http://cubanoticiasdisidentes.blogspot.com/2011/07/protestan-campesinos-cubanos-por-falta.html,NULL
,12-10-2011,La Habana,Manifestación/Concentración,Manifestación,Concentración,Ciudadanos/pueblo,"Derechos LGBTI (personas trans). Varias decenas de personas, entre las que había travestis, lesbianas y heterosexuales, protagonizaron una manifestación de rechazo a la detención de la persona transgénero ""Belinda"" frente a la estación de policía de Dragones.",Autoridades locales,NULL,"El oficial a cargo ordenó que soltaran a Belinda, no sin antes “sugerirle” que no hiciera ninguna acusación al policía, y así evitaría ser deportada a su provincia.",https://www.cubanet.org/noticias/ciudadanos-protestan-en-la-habana-contra-detencion-de-travesti/,NULL
,17-12-2011,La Habana,Marcha/Performance,Marcha,Performance,Artistas/OMNI,"Libertad de expresión. “La peregrinación del garabato es una promesa por la salud de la poesía; entendemos como poesía el estado general del país, de la nación cubana”.",Estado cubano/sociedad,NULL,NULL,NULL,NULL
,8-02-2012,San Miguel del PadrónLa Habana,Manifestación/Concentración,Manifestación,Concentración,Ciudadanos/pueblo,Derechos TPCP (impuestos). Grupo de vendedores protestaron en la calle por el hostigamiento de inspectores estatales y policías contra los vendedores por cuenta propia. “Todo comenzó porque los inspectores querían aplicarle una multa a una trabajadora que el día anterior ya habían multado”.,NULL,“Está bueno ya de atropellos”,"Inspectores estatales, acompañados por policías, han estado asediando a los vendedores por cuenta propia del reparto, aplicándoles multas de hasta 400 pesos en moneda nacional e inclusive arrestando a compradores.",https://www.cubanet.org/noticias/breves-destacados/protesta-publica-en-reparto-nunez/,NULL
P12-03,06-2012,La Habana,Performance,Performance,Performance,LGBTI,"DERECHOS LGBTI. Primera besada pública por el Día del Orgullo Gay, Proyecto Arcoíris.",Estado cubano/sociedad,Derechos LGBTI,IGNORAR (TOLERANCIA),https://es.globalvoices.org/2013/12/03/arcoiris-un-proyecto-cubano-que-lucha-contra-la-discriminacion-de-la-comunidad-lgbt/,NULL
,07-10-2012,"Varadero, Matanzas",Huelga,Huelga,Huelga,TPCP (cocheros),"CONTRA IMPUESTOS. DERECHOS ECONÓMICOS. 110 cocheros, con sus ayudantes, realizan un paro laboral en protesta por los altos impuestos que establece el Comité Estatal de Finanzas. Consideran excesivo tener que entregar unos 12 dólares diarios al Estado y exigen que el sindicato, que ellos pagan para que los defienda, negocie con las autoridades un acuerdo beneficioso para todas las partes.",Estado cubano,"""No vamos a trabajar hasta que nos bajen los impuestos. Queremos que esto sea conocimiento de las autoridades nacionales; pero además de la prensa independiente y extranjera"", González señaló: ""Recordemos a los gobernantes que esto no es un problema de política ni de contrarrevolución; lo que queremos es que ese sindicato que pagamos para que nos defienda responda ahora por nosotros y se llegue a un acuerdo sin que hayan partes afectadas"".","DIÁLOGO, PROMESAS",https://www.cubaencuentro.com/txt/cuba/noticias/cocheros-cubanos-realizan-paro-laboral-en-varadero-en-protesta-por-los-altos-impuestos-280643 http://vozdesdeeldestierro-juancarlosherreraacosta.over-blog.es/article-cuba-mas-de-un-centenar-de-cocheros-realizan-paro-laboral-en-varadero-110991144.html,No se satisfizo la demanda
,17-12-2012,La Habana,Marcha/Performance,Marcha,Performance,Artistas/OMNI,"Libertad de expresión. “La peregrinación del garabato es una promesa por la salud de la poesía, entendemos como poesía el estado general del país, de la nación cubana”.",Estado cubano/sociedad,"Libertad de expresión. “La peregrinación del garabato es una promesa por la salud de la poesía, entendemos como poesía el estado general del país, de la nación cubana”","TOLERANCIA, VIGILANCIA",NULL,NULL
,16-08-2013,Sancti Spiritus,Huelga,Huelga,Huelga,TPCP (cocheros),DERECHOS ECONÓMICOS CONTRA IMPUESTOS. “unos 300 cocheros” de esa ciudad iniciaron la huelga el martes 13 y la concluyeron el miércoles 14.,Autoridades locales,NULL,"DIÁLOGO. Un total de “cinco cabecillas identificados por la policía política fueron llevados a la sede de la Oficina Nacional de la Administración Tributaria (ONAT), donde les explicaron que debían ser cuidadosos y ahorrar durante todo el año para pagar los impuestos”.",NULL,NULL
,11-09-2013,Santa Clara,Huelga,Huelga,Huelga,TPCP (cocheros),CONTRA IMPUESTOS. DERECHOS ECONÓMICOS. Paro para exigir respuestas a los reclamos que habían formulado a la Asamblea Provincial de Poder Popular. ESTA PROTESTA FUE APOYADA POR GRUPOS DISIDENTES.,Autoridades locales (Asamblea Provincial del Poder Popular),"""A pesar de haber hecho una reclamación al gobierno para que les rebajen los impuestos, no recibían respuestas"".","Que varios activistas de DDHH fueron detenidos, entre ellos Guillermo Fariñas.",https://www.radiotelevisionmarti.com/a/cuba-cocheros-portesta-salarios-detenciones-/27353.html,NULL
,01-10-2013,"Puerto Padre, La Tunas",Plantón/Manifestación/Concentración,Plantón,"Manifestación, Concentración",TPCP (cocheros),Derechos TPCP. Cocheros reclaman su derecho a transitar por la carretera. Se produjo en inmediaciones de la sede del gobierno municipal. Las autoridades habían prometido acondicionar el camino de desvío.,Autoridades locales,NULL,"La respuesta del Gobierno tampoco se hizo esperar: en lo adelante y hasta tanto no se solucionen los problemas en el camino de desvío, pueden continuar transitando por la carretera.",https://www.cubanet.org/noticias/protesta-de-cocheros-en-puerto-padre-hace-ceder-al-gobierno/,NULL
,10-12-2013,La Habana,Manifestación/Concentración,Manifestación,Concentración,Artistas/intelectuales,"Libertad de expresión. Unos 40 artistas raperos protestan esta tarde frente a las oficinas del Instituto Cubano de la Música. El motivo de la queja es el cambio a última hora de la sede de Puños Arriba para un evento de música alternativa que debía realizarse el próximo jueves día 12. Poco antes lanzaron un manifiesto en redes sociales y fueron caminando hasta el lugar desde las calles Línea y 18, Vedado.",Autoridades locales,“La cultura es un derecho del pueblo”,"Fueron rodeados por la Seguridad del Estado, y durante las horas de protesta enfrentaban amenazas de arrestos y golpizas. Hubo un proceso de negociación con los funcionarios de la institución. Asimismo, los que quedaban esperando afuera aplaudían. Finalmente, luego de varias horas de negociaciones, la institución aceptó.",www.cubanet.org/noticias/unos-40-creadores-del-hip-hop-protestan-en-el-instituto-cubano-de-la-musica/ https://www.cubanet.org/noticias/el-15n-y-las-protestas-publicas-en-cuba-en-el-ultimo-decenio/ https://www.martinoticias.com/(S(eqzr34polip4ieklolqmdro))/a/raperos-cubanos-protestan-frente-instituto-de-la-musica/30088.html https://sociedadcivilcuba.net/archivo/observacuba/gala-punos-arriba-los-raperos-se-imponen-y-el-instituto-de-la-musica-rectifica/index.html,NULL
P13-04,17-12-2013,La Habana,Marcha/Performance,Marcha,Performance,Artistas/intelectuales,"LIBERTAD DE EXPRESIÓN. Peregrinación al Rincón Omni Zona Franca, unas 30 personas pidiendo salud, entendimiento, solidaridad, paz, libertad, sabiduría y amor para todos los cubanos sin distinción. Marcharon desde la fuente luminosa hasta el Rincón. También hay registro de la acción en 2009.",Estado cubano/sociedad,"""Un garabato para que se abran los caminos"" y entonces se improvisa: se pide el bienestar para Cuba, la libertad colectiva, individual… La gente se alegra. Unos jóvenes se nos unieron hasta el final, marchando. Otros, durante un tramo, se animaron a improvisar también; hubo alguien que se animó tanto que pidió un remo para abrir los mares y otro, libertad de expresión. Al final, en el templo, son las palabras del grupo a la nación, palabras vigiladas, que esta vez fueron individuales, pidiendo Salud, Entendimiento, Solidaridad, Paz, Libertad, Sabiduría, Amor para todos los cubanos"".","Los peregrinos fuimos escoltados por una patrulla de la PNR hasta El Rincón. En el tramo de Santiago de las Vegas a la iglesia, había un operativo policial con varias patrullas, camiones de la policía y muchos agentes de la Seguridad del Estado esperando a que los peregrinos llegaran ahí.",http://omnizonafranca.blogspot.com/2013/12/cuba-poesia-sin-fin-ya-comenzo.html?m=0 y  para 2'009  https://www.youtube.com/watch?v=tY1pMtGsQQ8,NULL
,21-01-2014,Holguín,Marcha/Manifestación/Concentración,Marcha,"Manifestación, Concentración",TPCP/Ciudadanos/Pueblo,Derechos TPCP. Un centenar de cuentapropistas protestaban en una zona céntrica por las recientes ordenanzas del gobierno que prohíben vender sus productos a quienes incluso han sacado licencia.,Autoridades locales,"""Queremos trabajar""",La Seguridad del Estado desplegó a sus agentes; muchos guardias iban de civil y esto llevó a una confusión tal que los propios manifestantes los golpearon para defenderse.,https://www.cubanet.org/actualidad-destacados/protesta-masiva-en-holguin/ https://www.youtube.com/watch?v=6LjXtCmHSNU,NULL
P14-05,17-02-2014,La Habana,Carta abierta,Carta abierta,Carta abierta,Afrodescendientes,DISCRIMINACIÓN RACIAL. Cofradía de la Negritud envía una carta abierta a la comisión organizadora del Congreso de la CTC para pedir que se rechace la discriminación en el ámbito laboral.,Autoridades locales (CTC),Discriminación racial laboral,SIN RESPUESTA,https://negracubanateniaqueser.com/2014/02/22/carta-abierta-de-la-cofradia-de-la-negritud-a-la-comision-organizadora-del-xx-congreso-de-la-central-de-trabajadores-de-cuba/,NULL
