id,fecha,lugar,tipo_evento,tipo_evento_principal,subtipos_evento,quien_protesta,demanda,a_quien,discurso_framing,respuesta_estatal,fuente,resultado
,14-10-2019,"Marianao, La Habana",Bloqueo,Bloqueo,Bloqueo,Ciudadanos/pueblo,"Servicios (vivienda). Decenas de habitantes cortaron el tráfico en el municipio de Marianao, en protesta contra los desalojos en una comunidad de bajos recursos de esa localidad.",Estado cubano/autoridades locales,“¡Abajo el desalojo! ¡En Cuba sí hay desalojo!”,"Hubo presencia de varios agentes de la Policía Nacional Revolucionaria. Al día siguiente fue que se presentaron las entidades correspondientes al sector, Planificación Física.",https://www.cubanet.org/noticias/protestan-contra-desalojos-y-demoliciones-en-la-habana/,NULL
P19-29,11-11-2019,La Habana,Plantón,Plantón,Plantón,Animalistas,"DERECHOS ANIMALES. Los activistas demandan un cambio en la forma en que se lleva a cabo la recogida de los animales en la calle, y piden que se sacrifiquen solamente aquellos que presenten una condición irreversible, no masivamente como se hace en la actualidad. Denunciaron que los perros estaban siendo sacrificados sin esperar las 48 horas que establece la ley. También piden el cierre del lugar contra el que pesan numerosas denuncias de maltrato animal y pidieron que se tomen medidas como la esterilización y la concientización de la población. En esta ocasión los activistas decidieron organizar la protesta de manera discreta y solo usaron mensajes de WhatsApp para acordar la fecha y la hora. Una vez instalados allí, compartieron su presencia por las redes y convocaron a un twitazo con los hashtags: #LeyDeProtecciónAnimalCubaYa, #ZoonosisAsesinos y #ZooNazis, sumándose algunos vecinos y otros activistas.","Autoridades locales (Centro de Observación Canina, Zoonosis)","Carteles que decían: ""Cierre de Zoonosis"", ""Abajo Zoonosis"", ""Estricnina no"", ""Esterilizar sí, matar no"", ""Hablamos por los que no tienen voz"", ""Ni una pata más"".","Acudieron al lugar policías y agentes de la Seguridad del Estado. Se organizó una reunión entre activistas que piden una Ley de Protección Animal en Cuba y las autoridades encargadas del tema en el Centro de Higiene y Epidemiología de La Habana, en la que ""no hubo solución, no hubo respuestas"".",https://www.cibercuba.com/noticias/2019-11-11-u1-e129488-s27061-cubanos-protestan-frente-instalacion-zoonosis-habana https://www.radiotelevisionmarti.com/a/activistas-sienten-que-el-gobierno-se-burla-ante-exigencia-de-protecci%C3%B3n-animal/252284.html,NULL
P19-30,21-11-2019,La Habana,Recogida de firmas/Petición,Recogida de firmas,Petición,Feministas,"LEY CONTRA LA VIOLENCIA DE GÉNERO. Solicitud de la Ley Integral contra la Violencia de Género y recogida de firmas: 40 firmas físicas (1000 por internet #YoSíTeCreo, en Change.org 3900).",Estado cubano (Parlamento),Contra la violencia de género,DIÁLOGO (no ley),https://negracubanateniaqueser.files.wordpress.com/2019/11/solicitud-de-ley-integral-contra-la-violencia-de-gc3a9nero-21_11_2019.pdf,NULL
,21-11-2019,La Habana,Carta abierta,Carta abierta,Carta abierta,Feministas,"CONTRA LA VIOLENCIA DE GÉNERO. Cientos de personas firmaron hasta el momento una carta abierta escrita por un grupo de feministas cubanas, que respaldan a la cantante y compositora Dianelys Alfonso, “La Diosa de Cuba”, así como a otras mujeres víctimas de agresiones sexistas. Hasta la noche del 28 de junio, 298 personas habían firmado la carta y muchas otras dejaron comentarios en la plataforma.",Estado cubano/sociedad,Contra la violencia de género,"INDIFERENCIA, RECHAZO",https://www.ipscuba.net/genero/carta-abierta-de-feministas-cubanas-respalda-a-mujeres-victimas/,NULL
P19-31,26-12-2019,La Habana,Marcha/Performance,Marcha,Performance,Animalistas,DERECHOS ANIMALES. Un grupo de activistas (20) por los derechos de los animales realizaron una marcha en silencio en protesta por la muerte violenta de un perro en Guanabacoa.,Estado cubano/sociedad,Derechos animales,"TOLERANCIA, INDIFERENCIA",https://oncubanews.com/cuba/animalistas-cubanos-marchan-en-silencio-por-perro-asesinado/,NULL
P19-32,01-12-2019,La Habana,Performance,Performance,Performance,Feministas,"CONTRA LA VIOLENCIA DE GÉNERO. En una explanada de la Universidad de las Artes (ISA) y autorizadas por su rector, una treintena de estudiantes, diseñadoras, periodistas y abogadas, sensibilizadas con la causa de las mujeres de Chile y por la no violencia machista, realizaron la coreografía con los ojos vendados.",Sociedad,Contra la violencia de género,"TOLERANCIA, COLABORACIÓN",https://www.ipscuba.net/genero/feministas-cubanas-replican-un-violador-en-tu-camino/,NULL
P19-33,14-02-2020,La Habana,Huelga,Huelga,Huelga,TPCP (boteros),"CONTRA IMPUESTOS, DERECHOS ECONÓMICOS. Los transportistas privados cubanos dieron a conocer un pliego de demandas al Gobierno como medida de presión para regresar con normalidad al trabajo, tras la puesta en vigor este mes de nuevas regulaciones para el transporte de pasajeros. Una lista de cinco exigencias fueron hechas públicas el jueves por la Asociación Cubana de Transportistas Autónomos (ACTA) en La Habana, Mayabeque y Artemisa, de acuerdo con el reporte de Radio Televisión Martí, que incluyen autorizar la libertad de movimiento para los taxistas privados; aprobar una sola licencia operativa de pasajeros; que se les permita trabajar en todo el país, incluidas las zonas turísticas, y se les autorice adquirir una cantidad de combustible según el consumo; además de poner fin al tope de precios decidido por el Gobierno.",Estado cubano,NULL,"Ha ocurrido una disminución de la represión en contra de los transportistas en servicio. ""La posición de las autoridades ha sido la de dejar hacer: no hay inspectores prácticamente hoy en las calles y la Policía no está parando los carros, como al principio lo hicieron, porque saben que la situación se va de su control"".",https://www.radiotelevisionmarti.com/a/cuba-boteros-taxis-privados-protestas-precios/126304.html  https://diariodecuba.com/cuba/1581677308_10953.html,NULL
P19-34,14-02-2020,La Habana,Performance,Performance,Performance,LGBTI,DERECHOS LGBTI. Se reunieron 30 activistas para protestar por la censura de un beso gay en una película.,ICRT,Derechos LGBTI,La Televisión Cubana se disculpa por la censura de un beso gay. Los activistas que convocaron a una besada frente al ICRT fueron amenazados y uno de ellos arrestado.,https://www.yucabyte.org/2020/03/03/las-controversias-de-una-disculpa/ https://twitter.com/14ymedio/status/1234160164347011073,NULL
,19-02-2020,La Habana,Manifestación/Concentración,Manifestación,Concentración,TPCP,"Derechos TPCP contra alza de impuestos. Protesta en una reunión en Marianao: “Queremos ver a la ministra”. “No nos valoran en la ley ni nos tratan como seres humanos. No tenemos derecho a vacaciones. Si sales de vacaciones tienes que pagar”. Una multitud evidentemente alterada y gritos de “queremos ver a la ministra”, es lo que muestra un video sobre una reunión de trabajadores por cuenta propia en La Habana, transformada en protesta espontánea de rechazo a orden de la Ministra de Comercio Interior de Cuba. La protesta respondió a un decreto de última hora que buscaría elevar los impuestos a los dueños de puntos de venta de viandas y carne de cerdo, al parecer con la intención de elevar el presupuesto estatal, en momentos en que el desabastecimiento de alimentos ha repercutido negativamente en la media histórica de ingresos en los mercados estatales. “Mira cuántos trabajadores y no hay sindicato”, “no nos valoran en la ley ni nos tratan como seres humanos. No tenemos derecho a vacaciones. Si sales de vacaciones tienes que pagar”, “yo tengo que decir que si viene un dirigente y me dice ´ustedes tienen un negocio´, yo tengo que responder ´no, el negocio lo tiene el Estado´, porque a nosotros no nos dan nada”.",Ministra de Comercio Interior,“Queremos ver a la ministra”,DIÁLOGO,https://www.cubanet.org/destacados/protesta-cuba-cuentapropistas-en-la-habana-contra-alza-de-impuestos,NULL
P19-35,12-03-2020,"Santa Clara, Villa Clara",Marcha/Manifestación (unas 500 personas),Marcha,Manifestación,TPCP,"LIBERTAD PARA COMERCIAR, DERECHOS ECONÓMICOS. Impedir el cierre de la llamada “candonga”, punto de ventas. En Santa Clara, y en Cuba, la relación entre estos espacios y las autoridades de gobierno ha sido tensa desde el inicio. La protesta fue un pico en esa tensión acumulada. La manifestación reunió a más de 500 personas y fue espontánea. Jessica estuvo en la manifestación organizada por estos cuentapropistas en Santa Clara, una movilización popular que partió desde la misma zona hospitalaria para detenerse por unos minutos frente al Gobierno Provincial. “Allí no nos hicieron caso, por eso nos fuimos para el Partido. Por el camino se nos fue sumando gente de la calle”, rememora. “Aquello se puso duro, mucha gritería, no sé decirte la cantidad de vendedores que había, pero éramos muchos”.",Autoridades locales (PCC)/Gobierno provincial,"“Queremos candonga, queremos comercio”. “No nos vamos de aquí hasta que no tengamos respuesta”. “Queremos importación”, “No dejen pasar los carros” o “Que vengan ellos aquí”. “Hasta que no nos respondan no se abre esta calle”.","DEMANDA SATISFECHA. DIÁLOGO Y PERMISO PARA QUE SIGAN VENDIENDO. Yudi Rodríguez Hernández, la secretaria del PCC provincial, conversa con manifestantes y les asegura de palabra “que estuviéramos tranquilos, que no iba a pasar nada”.",https://www.radiotelevisionmarti.com/a/protesta-hizo-que-jefa-del-pcc-en-villa-clara-pidiera-un-plazo-para-resolver-demandas/260089.html https://eltoque.com/la-protesta-de-los-candongueros-en-santa-clara-por-que-salieron-a-la-calle https://www.cubanet.org/destacados/cuba-queremos-comercio-protesta-masiva-santa-clara-candonga/    Yhttps://www.cubanet.org/destacados/por-que-se-rebelaron-los-cuentapropistas-en-santa-clara/ https://www.cubanet.org/destacados/por-que-se-rebelaron-los-cuentapropistas-en-santa-clara/,NULL
,01-06-2020,"Boyeros, La Habana",Manifestación/Concentración,Manifestación,Concentración,Ciudadanos/pueblo,"Servicio (vivienda). Decenas de mujeres radicadas en un albergue del municipio de Boyeros, protestaron contra el desalojo de Lisandra Arias Reyes, una adolescente embarazada que habita el local desde hace tres años. También denunciaron las malas condiciones del albergue y el foco de corrupción que tienen con los albergues y las viviendas.",Estado cubano/autoridades locales,"""Abajo el Gobierno, Abajo Castro, Abajo Díaz-Canel""",Hay presencia de un funcionario.,https://www.cubanet.org/noticias/mujeres-protestan-por-corrupcion-en-albergue-de-la-habana/,NULL
,15-06-2020,La Habana,Manifiesto/Comunicado/Petición,Manifiesto,"Comunicado, Petición",Artistas/intelectuales,"Libertad de expresión. Una decena de activistas, periodistas y opositores cubanos entregaron el lunes a las máximas instituciones cubanas los documentos que sustentan una petición para declarar la inconstitucionalidad del Decreto-Ley 370, conocido como ""Ley Azote"", instrumento legal que desde el inicio de la pandemia del COVID-19 usa el régimen para reprimir a periodistas, activistas y miembros de la sociedad civil por criticar en las redes sociales la situación del país.",Estado cubano,NULL,SIN RESPUESTA,https://diariodecuba.com/derechos-humanos/1591659557_23044.html,NULL
,16-06-2020,"Moa, Holguín",Manifestación/Concentración,Manifestación,Concentración,Ciudadanos/pueblo,"Servicios (alimentos). Un grupo de personas que no excedió las 40 o 50, se dirigieron hasta el Poder Popular y solicitaron la presencia de un funcionario que explicara la situación. De manera pacífica informaron que tienen hambre y necesitan ser atendidos con comida y aseo personal, en medio de una pandemia mundial como la COVID-19, y no hay nada de nada en las tiendas.",Autoridades locales,"""Queremos aseo""",NULL,https://www.cubanet.org/noticias/cubanos-protestan-en-holguin-por-la-escasez-de-comida-y-productos-de-aseo/,NULL
P20-36,22-06-2020,La Habana,Litigio,Litigio,Litigio,LGBTI,"DERECHOS LGBTI. Alberto Roque Guerra, activista LGBTI+ cubano y autor del blog HOMO Sapiens, anunció que impuso una demanda contra la cantante cubana Danay Suárez, blanco de críticas y en medio de una polémica luego de publicar en redes sociales su postura sobre la homosexualidad y la pedofilia.",Individuo,Derechos LGBTI,La cantante cubana Danay Suárez fue absuelta por el Tribunal Provincial Popular de La Habana.,https://www.ipscuba.net/sociedad/2020-resiliencia-en-tiempos-de-covid-19/ https://s3.eu-central-1.amazonaws.com/qurium/cubanet.org/noticias-activista-lgbti-presenta-demanda-contra-cantante-danay-suarez.html,NULL
,01-07-2020,la habana,Carta abierta,Carta abierta,Carta abierta,LGBTI,"DERECHOS LGBTI. Carta a Esteban Lazo Hernández DE Plataforma 11M Primero: Que los cuadros y dirigentes del ICRT, así como los asesores, directores, guionistas y demás trabajadores, reciban una mayor capacitación en temas de género, sexualidad y derechos sexuales. Segundo: Que las personas que incurran en actos discriminatorios sean sancionadas de acuerdo con la ley como forma de escarmiento por la violación de los principios constitucionales. Tercero: Que todas las alertas o demandas que se hagan al ICRT o cualquier otra institución pública por motivo de discriminación obtengan una debida respuesta, con el correspondiente reparo por el daño ocasionado a las personas o colectivos afectados. Cuarto: Que sea elaborada de inmediato una política oficial para el ICRT sobre el tratamiento de estos temas en los medios de comunicación que esté en consonancia con los principios constitucionales establecidos.",Estado cubano (Parlamento),Alarmante situación de violación de derechos fundamentales en la que incurre sistemáticamente el Instituto Cubano de Radio y Televisión (ICRT).,NULL,https://plataforma11mcuba.medium.com/carta-a-esteban-lazo-hern%C3%A1ndez-d2f98be1d478,NULL
,08-08-2020,"Morón, Ciego de Ávila",Manifestación/Concentración,Manifestación,Concentración,Ciudadanos/pueblo,"Servicios (vivienda). La familia Mora, con sus hijos pequeños, se plantó frente a la sede municipal del Partido Comunista de ese territorio a protestar pacíficamente en reclamo del derecho a una vivienda digna. Esta situación fue respaldada por ciudadanos del municipio.",Autoridades locales,"No se gritaron consignas contra los dirigentes, simplemente los afectados, que no son opositores, exigieron de manera pacífica sus derechos.","Agentes de la policía del régimen intentaron fallidamente desintegrar la manifestación, que no vio su fin hasta que la familia fue conducida ante las autoridades municipales, que prometieron una solución de vivienda.",https://www.cubanet.org/noticias/familia-cubana-protesta-frente-al-partido-de-moron/,NULL
,07-11-2020,"Carlos Rojas, Matanzas",Manifestación/Concentración,Manifestación,Concentración,Ciudadanos/pueblo,"SERVICIOS (electricidad). Decenas de personas rodearon a varios funcionarios, incluyendo uno vestido con uniforme militar, para exigir la restitución del servicio eléctrico. ""Estamos cansados de mentiras"", advierte la activista y Dama de Blanco, Sissi Abascal Zamora, a uno de los directivos. A la protesta se unieron tanto los opositores del pueblo como los ciudadanos comunes.",Autoridades locales,"""Mentirosos""",Había presencia de funcionarios militares en el lugar y restablecieron el servicio eléctrico después de la protesta.,https://www.14ymedio.com/cuba/Protesta-Carlos_Rojas-Matanzas-funcionarios-electricidad_0_2981101866.html,NULL
P20-37,17-11-2020,La Habana Vieja,Performance,Performance,Performance,Artistas (Movimiento San Isidro),"LIBERTAD DE EXPRESIÓN. Exigir la liberación inmediata de Denis Solís González, preso injustamente por expresar sus ideas políticas. Es un gesto que surgió frente a la estación de policía de Cuba y Chacón. La convocatoria a un susurro poético tuvo la intención de leer textos de autores como Federico García Lorca, Nicanor Parra, Francisco de Quevedo, Dylan Thomas o Sor Juana Inés de la Cruz; y de autores cubanos como Rafael Alcides, Virgilio Piñera, Lezama Lima, Dulce María Loynaz, Grupo Diáspora(s), Omar Pérez, y muchos otros. Este gesto fue llevado a cabo en la sede del Movimiento San Isidro, sito en Damas 955 entre San Isidro y Avenida del Puerto.",Estado cubano.,#EstamosConectados #Cuba #TodosConDenis,"Antes de comenzar el susurro poético, ya la sede del Movimiento San Isidro se encontraba sitiada por policías vestidos de civil.",https://rialta.org/en-directo-represion-cuba-msi/. https://www.facebook.com/Mv.SanIsidro/posts/387403486007309 https://twitter.com/Mov_sanisidro/status/1328805735376052228,NULL
P20-38,18-11-2020 / 26-11-2020,La Habana Vieja,"Huelga de hambre, sed y silencio",Huelga,Huelga de hambre,"Artistas (Luis Manuel Otero Alcántara, líder del Movimiento San Isidro)","LIBERTAD DE EXPRESIÓN. Exigir la liberación de Denis Solís, las restricciones de la libertad de expresión, la eliminación de las tiendas MLC. Después de la declaración de huelga de Alcántara, también se suman Esteban Rodríguez, Maykel Castillo y Humberto Mena; y en huelga de hambre Iliana Hernández, Yasser Castellanos, Adrián Rubio, Oscar Casanella y Osmani Pardo.",Estado cubano,#EstamosConectados #Cuba #TodosConDenis,"La policía intercepta a una vecina, Daylys Bandera Rodríguez, y le retira los suministros de comida y dinero que traía a nuestra sede. Comienza el acoso policial a la madre de un huelguista. La Seguridad del Estado le corta la electricidad a la sede del movimiento y le arrojan ácido por la puerta y por la azotea. La Seguridad del Estado impide el acceso de personas a la cuadra de la sede del MSI. El 26 de noviembre la policía cubana desalojó la sede del movimiento y",https://rialta.org/en-directo-represion-cuba-msi/  https://elpais.com/internacional/2020-11-27/la-policia-cubana-desaloja-la-sede-del-movimiento-san-isidro-y-detiene-a-varios-integrantes.html,NULL
P20-39,22-11-2020,"Parque Central, La Habana Vieja",Manifestación/Concentración,Manifestación,Concentración,Artistas/intelectuales/grupo de personas convocadas por el Movimiento San Isidro,LIBERTAD DE EXPRESIÓN. Liberación de Denis Solís y contra el asedio a los huelguistas que cumplieron 72 horas sin alimento.,Estado cubano.,NULL,"La tarde del sábado, el cerco policial en las inmediaciones de la sede del Movimiento intentó impedir el acceso a la vivienda de la esposa e hija del reportero independiente Esteban Rodríguez, así como a la hija del rapero Maykel Castillo ""Osorbo"". Los agentes a cargo del asedio quisieron impedir que las mujeres bajaran de un bicitaxi, en el que transportaban agua para los activistas. Por otra parte, en el Parque Central hay un fuerte despliegue policial y “actos de repudio” como represión a los cubanos que responden al llamado del Movimiento San Isidro. Arrestan a periodistas y activistas independientes. Hacia los alrededores del parque fueron movilizados “cuadros” del Gobierno municipal y del Partido Comunista para impedir la acción y realizar un acto de repudio, con gritos, manotazos y consignas, muy similar a los ocurridos en los años 80. La prensa extranjera fue expulsada del lugar y un ciudadano que portaba un cartel en apoyo a los manifestantes de Damas 955, la sede del MSI, fue perseguido por oficiales policiales.",https://diariodecuba.com/derechos-humanos/1605985722_26649.html https://rialta.org/en-directo-represion-cuba-msi/,NULL
P20-40,27-11-2020,"Vedado, La Habana",Plantón,Plantón,Plantón,Artistas/intelectuales/pueblo (entre 300 y 600 personas),"LIBERTAD DE EXPRESIÓN. Denuncian y condenan la incapacidad de las instituciones gubernamentales en Cuba para dialogar y reconocer el disenso, la autonomía activista, el empoderamiento de las minorías y el respeto a los derechos humanos y ciudadanos. En solidaridad con nuestros hermanos del Movimiento San Isidro exigimos que la justicia no se ejerza a discreción. La Cuba de hoy exige que el gobierno elimine el odio político y cree sistemas reales y efectivos desde donde se escuchen las demandas de la ciudadanía, estableciendo garantías para un diálogo desprejuiciado y honesto que no tenga represalias para los que alzan su voz. Basta de arrestos arbitrarios, de causas creadas a conveniencia y de caprichos desde el poder, que hoy no ha sabido responder al pueblo sino a su propia supervivencia en el poder.",Estado cubano (Ministerio de Cultura),"Se está cantando, se está rapeando, se está tocando guitarra. Cada 15 minutos se aplaude para levantar el ánimo.","Comenzaron a realizar redadas en las zonas aledañas al Ministerio. La respuesta del gobierno a los acontecimientos del 27N fue, instantáneamente, una reacción de seguridad nacional, que en el área comunicativa se basó esencialmente en la criminalización y segmentación binaria de los implicados en “revolucionarios” y “contrarrevolucionarios”. 48 horas después comenzó a articularse una respuesta política gubernamental más abarcadora, consistente en movilizar a sectores juveniles revolucionarios y en el despliegue, en redes sociales, de una estrategia comunicacional dirigida a bloquear a toda costa el diálogo con los manifestantes. Durante la noche ocurrió un corte de electricidad, la policía rodeó las cercanías del lugar y lanzó gases lacrimógenos a algunas personas que trataban de sumarse a la protesta.",https://www.facebook.com/RialtaEdiciones/posts/1056854901496605  https://rialta.org/en-directo-represion-cuba-msi/  https://twitter.com/IsmarioRodrguez/status/1332447183006822402 https://www.bbc.com/mundo/noticias-america-latina-55096075 https://eltoque.com/negociacion-27-noviembre-en-el-ministerio-de-cultura-exclusiva-con-yunior-garcia,NULL
,27-11-2020,La Habana,Manifiesto/Comunicado,Manifiesto,Comunicado,Artistas/intelectuales,"LIBERTAD DE EXPRESIÓN, DERECHOS POLÍTICOS CONTRA LA VIOLENCIA ESTATAL. Articulación Plebeya. Al mismo tiempo que más de 200 personas se congregaban fuera del Ministerio de Cultura en La Habana para demandar respeto a la libertad de expresión, de creación y el derecho a disentir, un grupo de intelectuales cubanos decidieron expresar, a través de una declaración, su apoyo a esta oportunidad de diálogo que se abre como nunca antes.",Estado cubano,"Desde posiciones diversas, pero movidos por una demanda ética compartida de rechazo a toda acción estatal violenta: crear una referencia ética, política, humana, de justicia social, de inclusión, de democracia, de rechazo a todas las formas de discriminación, para posibilitar un ambiente de diálogo y reconciliación en Cuba y en todos los lugares del mundo donde vivan cubanos y cubanas. Por la realización plena de la República democrática, la legalidad, el Estado de derecho y los derechos humanos para todos y todas; por el respeto al pluralismo político; por la reconciliación con el medio ambiente y con la vida; por la paz y el bienestar humanos, pedimos: que se cumpla el cronograma legislativo violado y la disposición constitucional transitoria decimosegunda, y que se revise la constitucionalidad de todas las normas de inferior jerarquía que contradigan la constitución y el desarrollo de un modelo propio de Estado de derecho, sus derechos, libertades y garantías. Creemos indispensable crear puentes de diálogo, en un primer momento en la sociedad civil cubana, tal como vemos en esta experiencia espontánea y autónoma de organización en los exteriores del Ministerio de Cultura, para avanzar hacia el consenso con otros sujetos sociales.","DESCALIFICACIÓN, PERSECUCIÓN, PRESIONES",https://www.facebook.com/articulacion.plebeya/posts/pfbid0CZ5hPDJxt5gf2px7VwuoTMmwPodHp8LsUsZLzZWRH6dBNjc87A39JVDhfp6suHy3l,NULL
,28-12-2020,La Habana,Carta abierta,Carta abierta,Carta abierta,Artistas/intelectuales,"LIBERTAD DE EXPRESIÓN. Integrantes de la plataforma 27N pidieron al ministro de Cultura del régimen cubano, Alpidio Alonso Grau, y a su segundo, Fernando Rojas, frenar la “escalada de injusticias, violencia y odio contra quienes tienen un pensamiento político diferente”, en especial contra la comunidad de intelectuales y artistas. La misiva, firmada por más de 70 miembros de ese grupo, responde al cumplimiento del primer mes de la protesta pacífica frente al MINCULT, en La Habana, exigiendo el cese de la represión y la censura, y el respeto a la libertad de expresión y el derecho a existir de todos los cubanos.",Estado cubano (Ministerio de Cultura),NULL,NULL,https://www.cubanet.org/noticias/27n-dirige-carta-al-mincult/,NULL
